,number,value,datetime_start,datetime_complete,duration,params_BATCH_SIZE,params_Dropout,params_In_Channel,params_MODEL_NAME_CNN,params_MODEL_NAME_MLP,params_cleassifier,params_focal_gamma,params_learning_rate,params_loss,params_num_warmup_steps_divide,params_optimizer,state
0,0,0.6770207903742991,2024-01-25 14:31:31.062691,2024-01-25 14:52:08.171430,0 days 00:20:37.108739,4,0.4,4.0,bert-base-uncased,,cnn,,0.002271653072812881,cross_entropy,11,SGD,COMPLETE
1,1,0.24328722538649308,2024-01-25 14:52:08.199056,2024-01-25 15:01:17.341844,0 days 00:09:09.142788,4,0.2,,,roberta-base,mlp,,0.0017201982413584179,cross_entropy,13,AdamW,COMPLETE
2,2,0.24328722538649308,2024-01-25 15:01:17.363898,2024-01-25 15:05:46.188699,0 days 00:04:28.824801,8,0.4,,,bert-base-uncased,mlp,,0.003762442069761878,cross_entropy,11,AdamW,COMPLETE
3,3,0.6503871486369942,2024-01-25 15:05:46.209749,2024-01-25 15:14:48.826455,0 days 00:09:02.616706,4,0.4,2.0,vinai/bertweet-base,,cnn,2.0,0.000500070651546121,focal,2,RMSprop,COMPLETE
4,4,0.6616597145834513,2024-01-25 15:14:48.847754,2024-01-25 15:31:46.046405,0 days 00:16:57.198651,8,0.30000000000000004,3.0,roberta-base,,cnn,5.0,0.009063770196060786,focal,5,SGD,COMPLETE
5,5,0.24328722538649308,2024-01-25 15:31:46.075430,2024-01-25 15:34:12.699075,0 days 00:02:26.623645,8,0.4,4.0,bert-base-uncased,,cnn,,0.004635369135886789,cross_entropy,15,Adam,PRUNED
6,6,0.24328722538649308,2024-01-25 15:34:12.722966,2024-01-25 15:36:36.714843,0 days 00:02:23.991877,8,0.4,,,vinai/bertweet-base,mlp,2.0,0.007194443644181688,focal,9,AdamW,PRUNED
7,7,0.559649647887324,2024-01-25 15:36:36.746093,2024-01-25 15:43:44.003236,0 days 00:07:07.257143,8,0.5,3.0,bert-base-uncased,,cnn,3.0,0.0012723577038418223,focal,3,Adam,COMPLETE
8,8,0.24328722538649308,2024-01-25 15:43:44.024251,2024-01-25 15:45:59.262855,0 days 00:02:15.238604,8,0.30000000000000004,1.0,roberta-base,,cnn,5.0,0.006929643024203959,focal,10,RMSprop,PRUNED
9,9,0.24328722538649308,2024-01-25 15:45:59.335227,2024-01-25 15:49:01.602013,0 days 00:03:02.266786,4,0.4,5.0,bert-base-uncased,,cnn,,0.0035318652525605206,cross_entropy,7,RMSprop,PRUNED
10,10,0.24328722538649308,2024-01-25 15:49:01.680069,2024-01-25 15:51:47.707069,0 days 00:02:46.027000,4,0.1,,,xlm-roberta-base,mlp,,0.0024260914770462354,cross_entropy,13,SGD,PRUNED
11,11,0.681799561673003,2024-01-25 15:51:48.023523,2024-01-25 16:12:54.248382,0 days 00:21:06.224859,4,0.2,4.0,roberta-base,,cnn,5.0,0.009965712535681683,focal,5,SGD,COMPLETE
12,12,0.30045877213404365,2024-01-25 16:12:54.298935,2024-01-25 16:15:59.056914,0 days 00:03:04.757979,4,0.2,5.0,xlm-roberta-base,,cnn,,0.009812261854617359,cross_entropy,6,SGD,PRUNED
13,13,0.6506611428935266,2024-01-25 16:15:59.272469,2024-01-25 16:29:32.485170,0 days 00:13:33.212701,4,0.2,4.0,roberta-base,,cnn,4.0,0.00624362983597253,focal,8,SGD,PRUNED
14,14,0.24433842894540111,2024-01-25 16:29:32.524971,2024-01-25 16:32:43.096837,0 days 00:03:10.571866,4,0.1,4.0,xlm-roberta-base,,cnn,4.0,0.008277065274340719,focal,4,SGD,PRUNED
15,15,0.7011065435425025,2024-01-25 16:32:43.381806,2024-01-25 16:54:26.391261,0 days 00:21:43.009455,4,0.5,4.0,vinai/bertweet-base,,cnn,,0.005729562752954323,cross_entropy,12,SGD,COMPLETE
16,16,0.5063219829029357,2024-01-25 16:54:26.441210,2024-01-25 16:57:11.477340,0 days 00:02:45.036130,4,0.5,5.0,vinai/bertweet-base,,cnn,1.0,0.005546921919898544,focal,15,SGD,PRUNED
17,17,0.697053147333821,2024-01-25 16:57:11.523724,2024-01-25 17:17:45.411575,0 days 00:20:33.887851,4,0.2,2.0,vinai/bertweet-base,,cnn,,0.008044490626396936,cross_entropy,13,SGD,COMPLETE
18,18,0.24328722538649308,2024-01-25 17:17:45.441132,2024-01-25 17:22:21.094408,0 days 00:04:35.653276,4,0.30000000000000004,,,microsoft/deberta-base,mlp,,0.008003382068262623,cross_entropy,13,Adam,PRUNED
19,19,0.6865731674252727,2024-01-25 17:22:21.124192,2024-01-25 17:42:42.495665,0 days 00:20:21.371473,4,0.5,2.0,vinai/bertweet-base,,cnn,,0.005255065110036783,cross_entropy,12,SGD,COMPLETE
20,20,0.6923430345725348,2024-01-25 17:42:42.555811,2024-01-25 18:03:02.134231,0 days 00:20:19.578420,4,0.1,2.0,vinai/bertweet-base,,cnn,,0.007641896876742282,cross_entropy,15,SGD,COMPLETE
21,21,0.6902043171442918,2024-01-25 18:03:02.158047,2024-01-25 18:23:01.339065,0 days 00:19:59.181018,4,0.1,2.0,vinai/bertweet-base,,cnn,,0.0077674309873747,cross_entropy,14,SGD,COMPLETE
22,22,0.6954401977729869,2024-01-25 18:23:01.377242,2024-01-25 18:42:34.048901,0 days 00:19:32.671659,4,0.1,1.0,vinai/bertweet-base,,cnn,,0.006375224054132697,cross_entropy,15,SGD,COMPLETE
23,23,0.6576282737944478,2024-01-25 18:42:34.079415,2024-01-25 18:49:43.245157,0 days 00:07:09.165742,4,0.2,1.0,vinai/bertweet-base,,cnn,,0.006038826051114825,cross_entropy,12,SGD,PRUNED
24,24,0.5544324227224363,2024-01-25 18:49:43.349528,2024-01-25 18:52:01.288619,0 days 00:02:17.939091,4,0.1,1.0,vinai/bertweet-base,,cnn,,0.004348172040097999,cross_entropy,14,SGD,PRUNED
25,25,0.4264424465324397,2024-01-25 18:52:01.407341,2024-01-25 18:54:34.280629,0 days 00:02:32.873288,4,0.2,1.0,vinai/bertweet-base,,cnn,,0.006502288331294758,cross_entropy,10,SGD,PRUNED
26,26,0.24328722538649308,2024-01-25 18:54:34.396751,2024-01-25 18:57:20.058525,0 days 00:02:45.661774,4,0.30000000000000004,,,vinai/bertweet-base,mlp,,0.008774900833742952,cross_entropy,14,RMSprop,PRUNED
27,27,0.24328722538649308,2024-01-25 18:57:20.162055,2024-01-25 19:00:32.752754,0 days 00:03:12.590699,4,0.1,3.0,vinai/bertweet-base,,cnn,,0.005656743849115881,cross_entropy,12,Adam,PRUNED
28,28,0.24328722538649308,2024-01-25 19:00:32.859189,2024-01-25 19:03:59.373503,0 days 00:03:26.514314,4,0.2,2.0,vinai/bertweet-base,,cnn,,0.006652092845545526,cross_entropy,11,AdamW,PRUNED
29,29,0.24328722538649308,2024-01-25 19:03:59.407898,2024-01-25 19:06:48.943083,0 days 00:02:49.535185,4,0.5,1.0,xlm-roberta-base,,cnn,,0.008771333364272207,cross_entropy,11,SGD,PRUNED
30,30,0.6985875011310171,2024-01-25 19:06:49.240994,2024-01-25 19:26:34.901004,0 days 00:19:45.660010,4,0.30000000000000004,2.0,vinai/bertweet-base,,cnn,,0.007337677162646834,cross_entropy,14,SGD,COMPLETE
31,31,0.6687449190495617,2024-01-25 19:26:34.948491,2024-01-25 19:34:07.356811,0 days 00:07:32.408320,4,0.30000000000000004,2.0,vinai/bertweet-base,,cnn,,0.007197110963292462,cross_entropy,14,SGD,PRUNED
32,32,0.6793879324298632,2024-01-25 19:34:07.406672,2024-01-25 19:46:54.473758,0 days 00:12:47.067086,4,0.2,3.0,vinai/bertweet-base,,cnn,,0.004950244531872099,cross_entropy,13,SGD,PRUNED
33,33,0.6977859859366878,2024-01-25 19:46:54.503792,2024-01-25 20:07:06.534992,0 days 00:20:12.031200,4,0.1,2.0,vinai/bertweet-base,,cnn,,0.0061221088381924705,cross_entropy,15,SGD,COMPLETE
34,34,0.24328722538649308,2024-01-25 20:07:06.577899,2024-01-25 20:10:17.778560,0 days 00:03:11.200661,4,0.30000000000000004,,,roberta-base,mlp,,0.003774387560957224,cross_entropy,13,AdamW,PRUNED
35,35,0.619737264442702,2024-01-25 20:10:17.809620,2024-01-25 20:17:56.414329,0 days 00:07:38.604709,4,0.2,3.0,vinai/bertweet-base,,cnn,,0.007335394041958792,cross_entropy,12,SGD,PRUNED
36,36,0.6033984451870538,2024-01-25 20:17:56.437882,2024-01-25 20:22:04.278896,0 days 00:04:07.841014,8,0.4,2.0,vinai/bertweet-base,,cnn,,0.008255740748958188,cross_entropy,14,SGD,PRUNED
37,37,0.24328722538649308,2024-01-25 20:22:04.353180,2024-01-25 20:24:59.562183,0 days 00:02:55.209003,4,0.4,,,bert-base-uncased,mlp,,0.009307817462870776,cross_entropy,10,AdamW,PRUNED
38,38,0.24328722538649308,2024-01-25 20:24:59.649010,2024-01-25 20:27:20.458540,0 days 00:02:20.809530,8,0.4,3.0,vinai/bertweet-base,,cnn,,0.004600298890222744,cross_entropy,15,RMSprop,PRUNED
39,39,0.1644144144144144,2024-01-25 20:27:20.522480,2024-01-25 20:29:48.177371,0 days 00:02:27.654891,8,0.5,2.0,vinai/bertweet-base,,cnn,,0.005980316732075689,cross_entropy,13,Adam,PRUNED
